{"$schema":"https://json-schema.org/draft/2020-12/schema","$id":"https://chatman.dev/schemas/fleet-recent-activity.schema.json","title":"Recent fleet activity observation","type":"object","required":["schema","observation_id","owner","window","query","subject","repository_count","authority","standing","repositories"],"properties":{"schema":{"const":"https://chatman.dev/fleet/recent-activity/v1"},"observation_id":{"type":"string","minLength":1},"owner":{"const":"seanchatmangpt"},"window":{"type":"object","required":["start","end"],"properties":{"start":{"type":"string"},"end":{"type":"string"}},"additionalProperties":false},"query":{"type":"string","minLength":1},"subject":{"type":"object","required":["repository","base_sha"],"properties":{"repository":{"const":"seanchatmangpt/chatman-ecosystem"},"base_sha":{"type":"string","pattern":"^[0-9a-f]{40}$"}},"additionalProperties":false},"repository_count":{"type":"integer","minimum":1},"authority":{"const":"NONE"},"standing":{"const":"OBSERVED"},"semantics":{"type":"array","items":{"type":"string"}},"repositories":{"type":"array","minItems":1,"items":{"type":"object","required":["repository","default_branch","observed_sha","commit_timestamp","latest_message","authority","standing","read_only"],"properties":{"repository":{"type":"string","pattern":"^seanchatmangpt/[A-Za-z0-9_.-]+$"},"default_branch":{"type":"string","minLength":1},"observed_sha":{"type":"string","pattern":"^[0-9a-f]{40}$"},"commit_timestamp":{"type":"string","minLength":1},"latest_message":{"type":"string"},"authority":{"const":"NONE"},"standing":{"const":"OBSERVED"},"read_only":{"type":"boolean"}},"additionalProperties":false}}},"additionalProperties":false}
