{
  "schema": "https://chatman.dev/fleet/recent-activity/v1",
  "observation_id": "fleet:recent:2026-09-30:7d",
  "owner": "seanchatmangpt",
  "window": {
    "start": "2026-09-23T00:00:00Z",
    "end": "2026-09-30T07:16:00Z"
  },
  "query": "user:seanchatmangpt pushed:>=2026-09-23",
  "subject": {
    "repository": "seanchatmangpt/chatman-ecosystem",
    "base_sha": "869babb1d0c852e0ceda581a3edfea6d32189d95"
  },
  "repository_count": 101,
  "authority": "NONE",
  "standing": "OBSERVED",
  "semantics": [
    "Observation evidence only; no release standing is promoted.",
    "Historical release manifests remain immutable admitted facts.",
    "Rows bind observed repository/default-branch commit evidence at this horizon.",
    "seanchatmangpt/ggen is observation-only/read-only."
  ],
  "repositories": [
    {
      "repository": "seanchatmangpt/A2A",
      "default_branch": "main",
      "observed_sha": "188f2c7582ada98403a56b85814a8cc87e86d530",
      "commit_timestamp": "2026-09-29T20:05:42Z",
      "latest_message": "chore(sjira): add v26.9.29 fleet work order",
      "authority": "NONE",
      "standing": "OBSERVED",
      "read_only": false
    },
    {
      "repository": "seanchatmangpt/a2a-rs",
      "default_branch": "master",
      "observed_sha": "75ba4a6ea3104c0edb0b31f4286faedf1a6964a6",
      "commit_timestamp": "2026-09-29T22:25:37Z",
      "latest_message": "Merge pull request #14 from seanchatmangpt/pay/v26.9.29-a2a-payments-audit-fix2",
      "authority": "NONE",
      "standing": "OBSERVED",
      "read_only": false
    },
    {
      "repository": "seanchatmangpt/affidavit",
      "default_branch": "main",
      "observed_sha": "9888b4084d8d7f4cf9337f572c6bbfb592f94e09",
      "commit_timestamp": "2026-09-30T06:52:49Z",
      "latest_message": "Merge QME-1 canonical hardening rebind",
      "authority": "NONE",
      "standing": "OBSERVED",
      "read_only": false
    },
    {
      "repository": "seanchatmangpt/agent-guides",
      "default_branch": "main",
      "observed_sha": "a02da0fc73c83dd2efff2699beaa8f0e06e72f72",
      "commit_timestamp": "2026-09-29T20:05:56Z",
      "latest_message": "chore(sjira): add v26.9.29 fleet work order",
      "authority": "NONE",
      "standing": "OBSERVED",
      "read_only": false
    },
    {
      "repository": "seanchatmangpt/agent-zero",
      "default_branch": "main",
      "observed_sha": "41b9e0b8d28f5b058b2d91ed30e590f2489b84d9",
      "commit_timestamp": "2026-09-29T20:05:51Z",
      "latest_message": "chore(sjira): add v26.9.29 fleet work order",
      "authority": "NONE",
      "standing": "OBSERVED",
      "read_only": false
    },
    {
      "repository": "seanchatmangpt/agile-protocol-specification",
      "default_branch": "main",
      "observed_sha": "1b731a6e963fa249c4e3e8bcbe932025c5e38bb5",
      "commit_timestamp": "2026-09-26T08:58:52Z",
      "latest_message": "Merge pull request #10 from seanchatmangpt/adopt/engineering-standards-v26.9.21",
      "authority": "NONE",
      "standing": "OBSERVED",
      "read_only": false
    },
    {
      "repository": "seanchatmangpt/AgileGen",
      "default_branch": "main",
      "observed_sha": "4c080875d20968eaeb47e83b66e471bc57e3cc76",
      "commit_timestamp": "2026-09-29T20:05:48Z",
      "latest_message": "chore(sjira): add v26.9.29 fleet work order",
      "authority": "NONE",
      "standing": "OBSERVED",
      "read_only": false
    },
    {
      "repository": "seanchatmangpt/ai",
      "default_branch": "main",
      "observed_sha": "19d9869e4885d8c2c7309622a563b96d00a41c75",
      "commit_timestamp": "2026-09-29T20:06:31Z",
      "latest_message": "chore(sjira): add v26.9.29 fleet work order",
      "authority": "NONE",
      "standing": "OBSERVED",
      "read_only": false
    },
    {
      "repository": "seanchatmangpt/ai-elements",
      "default_branch": "main",
      "observed_sha": "d2a91c986bbf7e70fc5779c6c1b124724ac29d5f",
      "commit_timestamp": "2026-09-29T20:06:28Z",
      "latest_message": "chore(sjira): add v26.9.29 fleet work order",
      "authority": "NONE",
      "standing": "OBSERVED",
      "read_only": false
    },
    {
      "repository": "seanchatmangpt/aider",
      "default_branch": "main",
      "observed_sha": "fd326a7cec7126df9ab6acf5856f31450e5f32ee",
      "commit_timestamp": "2026-09-29T20:05:24Z",
      "latest_message": "chore(sjira): add v26.9.29 fleet work order",
      "authority": "NONE",
      "standing": "OBSERVED",
      "read_only": false
    },
    {
      "repository": "seanchatmangpt/algokit-core",
      "default_branch": "main",
      "observed_sha": "e31e2896097250d1d02aa589e91a3fb58de054fa",
      "commit_timestamp": "2026-09-29T20:05:11Z",
      "latest_message": "chore(sjira): add v26.9.29 fleet work order",
      "authority": "NONE",
      "standing": "OBSERVED",
      "read_only": false
    },
    {
      "repository": "seanchatmangpt/anti-llm-cheat-lsp",
      "default_branch": "main",
      "observed_sha": "c828e4f6d8230e3219112ccd4242414f17577801",
      "commit_timestamp": "2026-09-26T13:07:28Z",
      "latest_message": "Merge pull request #5 from seanchatmangpt/dependabot/github_actions/actions/download-artifact-8",
      "authority": "NONE",
      "standing": "OBSERVED",
      "read_only": false
    },
    {
      "repository": "seanchatmangpt/Arazzo-Specification",
      "default_branch": "main",
      "observed_sha": "6935c78908ac839400180da6c045be0c58f3d555",
      "commit_timestamp": "2026-09-29T20:06:04Z",
      "latest_message": "chore(sjira): add v26.9.29 fleet work order",
      "authority": "NONE",
      "standing": "OBSERVED",
      "read_only": false
    },
    {
      "repository": "seanchatmangpt/ash",
      "default_branch": "main",
      "observed_sha": "733564da755cf9240cb2b6d8b32c6e4fce8ba5d5",
      "commit_timestamp": "2026-09-30T06:51:50Z",
      "latest_message": "Merge QME-1 canonical hardening rebind",
      "authority": "NONE",
      "standing": "OBSERVED",
      "read_only": false
    },
    {
      "repository": "seanchatmangpt/ash_a2a",
      "default_branch": "main",
      "observed_sha": "3325032d9dea201e6deb82ef242c534aacb3b420",
      "commit_timestamp": "2026-09-30T06:53:14Z",
      "latest_message": "Merge QME-1 canonical hardening rebind",
      "authority": "NONE",
      "standing": "OBSERVED",
      "read_only": false
    },
    {
      "repository": "seanchatmangpt/ash_admin",
      "default_branch": "main",
      "observed_sha": "60ffebc6ca25ae90be58fe813201dc9caf2771a1",
      "commit_timestamp": "2026-09-29T20:07:15Z",
      "latest_message": "chore(sjira): add v26.9.29 fleet work order",
      "authority": "NONE",
      "standing": "OBSERVED",
      "read_only": false
    },
    {
      "repository": "seanchatmangpt/ash_ai",
      "default_branch": "main",
      "observed_sha": "24020d038e96c3ef2f32476e7972b606d0c8ee03",
      "commit_timestamp": "2026-09-29T20:07:13Z",
      "latest_message": "chore(sjira): add v26.9.29 fleet work order",
      "authority": "NONE",
      "standing": "OBSERVED",
      "read_only": false
    },
    {
      "repository": "seanchatmangpt/ash_archival",
      "default_branch": "main",
      "observed_sha": "a66d3a9df5ad5490d62528c80ec00f089d2ae56d",
      "commit_timestamp": "2026-09-29T20:07:11Z",
      "latest_message": "chore(sjira): add v26.9.29 fleet work order",
      "authority": "NONE",
      "standing": "OBSERVED",
      "read_only": false
    },
    {
      "repository": "seanchatmangpt/ash_atlassian",
      "default_branch": "main",
      "observed_sha": "43e3d21b7c4e4571493fcf3757392ed16f2dd967",
      "commit_timestamp": "2026-09-28T19:50:16Z",
      "latest_message": "Merge pull request #5 from seanchatmangpt/claude/adoring-gauss-wqwp0c",
      "authority": "NONE",
      "standing": "OBSERVED",
      "read_only": false
    },
    {
      "repository": "seanchatmangpt/ash_blog",
      "default_branch": "main",
      "observed_sha": "42b40c35128074ac94323a6288da1359a474d151",
      "commit_timestamp": "2026-09-29T20:07:08Z",
      "latest_message": "chore(sjira): add v26.9.29 fleet work order",
      "authority": "NONE",
      "standing": "OBSERVED",
      "read_only": false
    },
    {
      "repository": "seanchatmangpt/ash_cloak",
      "default_branch": "main",
      "observed_sha": "1c52c5955533813aa0649d615b7e3aadcde3a2f1",
      "commit_timestamp": "2026-09-29T20:07:03Z",
      "latest_message": "chore(sjira): add v26.9.29 fleet work order",
      "authority": "NONE",
      "standing": "OBSERVED",
      "read_only": false
    },
    {
      "repository": "seanchatmangpt/ash_commanded",
      "default_branch": "main",
      "observed_sha": "4fe33b75388605221631a82d2af5bdeb1bf1bc26",
      "commit_timestamp": "2026-09-29T20:07:01Z",
      "latest_message": "chore(sjira): add v26.9.29 fleet work order",
      "authority": "NONE",
      "standing": "OBSERVED",
      "read_only": false
    },
    {
      "repository": "seanchatmangpt/ash_csv",
      "default_branch": "main",
      "observed_sha": "209842cb998b03e49f38d33405298aaac3766158",
      "commit_timestamp": "2026-09-29T20:06:59Z",
      "latest_message": "chore(sjira): add v26.9.29 fleet work order",
      "authority": "NONE",
      "standing": "OBSERVED",
      "read_only": false
    },
    {
      "repository": "seanchatmangpt/ash_double_entry",
      "default_branch": "main",
      "observed_sha": "0d419c342ded40b7e8169780a32824dec71751e2",
      "commit_timestamp": "2026-09-29T20:06:56Z",
      "latest_message": "chore(sjira): add v26.9.29 fleet work order",
      "authority": "NONE",
      "standing": "OBSERVED",
      "read_only": false
    },
    {
      "repository": "seanchatmangpt/ash_dspy",
      "default_branch": "main",
      "observed_sha": "3b6b527579bcb4ece0a731ea60a283ff3706d8d4",
      "commit_timestamp": "2026-09-26T01:02:29Z",
      "latest_message": "test: real composition verification + ledgered hand-written residue",
      "authority": "NONE",